CDREDE;DE;CODMUN;MUN;CATEG;TIPOESC;COD_ESC;NOMESC;AL_ALEMAO_DU;AL_ESPANHOL_DU;AL_FRANCES_DU;AL_INGLES_DU;AL_ITALIANO_DU;AL_JAPONES_DU;AL_MANDARIM_DU;TOTAL_AL_DU;AL_ALEMAO_SAB_SEMANA;AL_ESPANHOL_SAB_SEMANA;AL_FRANCES_SAB_SEMANA;AL_INGLES_SAB_SEMANA;AL_ITALIANO_SAB_SEMANA;AL_JAPONES_SAB_SEMANA;AL_MANDARIM_SAB_SEMANA;AL_ALEMAO_SAB;AL_ESPANHOL_SAB;AL_FRANCES_SAB;AL_INGLES_SAB;AL_ITALIANO_SAB;AL_JAPONES_SAB;AL_MANDARIM_SAB;TOTAL_AL_SAB;CL_ALEMAO_DU;CL_ESPANHOL_DU;CL_FRANCES_DU;CL_INGLES_DU;CL_ITALIANO_DU;CL_JAPONES_DU;CL_MANDARIM_DU;TOTAL_CL_DU;CL_ALEMAO_SAB_SEMANA;CL_ESPANHOL_SAB_SEMANA;CL_FRANCES_SAB_SEMANA;CL_INGLES_SAB_SEMANA;CL_ITALIANO_SAB_SEMANA;CL_JAPONES_SAB_SEMANA;CL_MANDARIM_SAB_SEMANA;CL_ALEMAO_SAB;CL_ESPANHOL_SAB;CL_FRANCES_SAB;CL_INGLES_SAB;CL_ITALIANO_SAB;CL_JAPONES_SAB;CL_MANDARIM_SAB;TOTAL_CL_SAB;TOTAL_TOTAL_AL;TOTAL_TOTAL_CL
20909;MIRANTE DO PARANAPANEMA;450;MIRANTE DO PARANAPANEMA;2;6;459859;CEL JTO A EE JOSE QUIRINO CAVALCANTE;0;60;0;21;0;0;0;80;0;0;0;0;0;0;0;0;0;0;0;0;0;0;0;0;8;0;2;0;0;0;10;0;0;0;0;0;0;0;0;0;0;0;0;0;0;0;80;10
20909;MIRANTE DO PARANAPANEMA;690;TEODORO SAMPAIO;2;6;459948;CEL JTO A EE ARTHUR RIBEIRO;0;85;0;0;0;0;0;85;0;0;0;0;0;0;0;0;0;0;0;0;0;0;0;0;6;0;0;0;0;0;6;0;0;0;0;0;0;0;0;0;0;0;0;0;0;0;85;6
21001;ASSIS;189;ASSIS;2;6;428760;CEL JTO A EE PROF CARLOS ALBERTO DE OLIVEIRA;0;172;21;106;42;54;0;404;0;0;0;0;0;0;0;6;83;50;39;10;44;0;253;0;14;3;8;4;5;0;37;0;0;0;0;0;0;0;2;8;3;4;2;4;0;25;590;62
21001;ASSIS;436;MARACAI;2;6;985485;CEL JTO A EE MARIA APARECIDA GALHARINI DOS SANTOS PROFA;0;16;0;0;0;0;0;16;0;0;0;0;0;0;0;0;0;0;0;0;0;0;0;0;3;0;0;0;0;0;3;0;0;0;0;0;0;0;0;0;0;0;0;0;0;0;16;3
21001;ASSIS;501;PALMITAL;2;6;341010;CEL JTO A EE ADALGISA CAVEZZALE DE CAMPOS PROFA;0;87;0;0;16;48;0;141;0;0;0;0;0;0;0;0;10;32;0;10;10;0;62;0;10;0;0;4;3;0;17;0;0;0;0;0;0;0;0;2;1;0;2;2;0;7;178;24
21001;ASSIS;503;PARAGUACU PAULISTA;2;6;985521;CEL JTO A EE DIVA FIGUEIREDO DA SILVEIRA;0;30;0;0;0;0;0;30;0;0;0;0;0;0;0;0;0;0;0;0;0;0;0;0;6;0;0;0;0;0;6;0;0;0;0;0;0;0;0;0;0;0;0;0;0;0;30;6
21003;MARILIA;548;POMPEIA;2;6;459768;CEL JTO A EE CULTURA E LIBERDADE;0;88;0;76;0;0;0;162;0;0;0;0;0;0;0;0;0;0;0;0;0;0;0;0;18;0;6;0;0;0;24;0;0;0;0;0;0;0;0;0;0;0;0;0;0;0;162;24
21004;OURINHOS;495;OURINHOS;2;6;363625;CEL JTO A EE DOMINGOS CAMERLINGO CALO;0;0;0;0;0;0;0;0;0;0;0;0;0;0;0;0;126;0;61;0;0;0;183;0;0;0;0;0;0;0;0;0;0;0;0;0;0;0;0;12;0;3;0;0;0;15;183;15
21004;OURINHOS;612;SANTA CRUZ DO RIO PARDO;2;6;460230;CEL JTO A EE LEONIDAS DO AMARAL VIEIRA;0;0;0;0;0;0;0;0;0;0;0;0;0;0;0;0;52;0;73;0;0;0;125;0;0;0;0;0;0;0;0;0;0;0;0;0;0;0;0;4;0;3;0;0;0;7;125;7
21006;TUPA;697;TUPA;2;6;985512;CEL JTO A EE INDIA VANUIRE;0;31;0;0;22;0;0;47;0;0;0;0;0;0;0;0;3;0;28;21;0;0;52;0;4;0;0;2;0;0;6;0;0;0;0;0;0;0;0;2;0;2;2;0;0;6;94;12
21101;MIRACATU;448;MIRACATU;2;6;459781;CEL JTO A EE ARMANDO GONCALVES PROF;0;32;0;0;0;0;0;32;0;0;0;0;0;0;0;0;0;0;0;0;0;0;0;0;6;0;0;0;0;0;6;0;0;0;0;0;0;0;0;0;0;0;0;0;0;0;32;6
21102;REGISTRO;574;REGISTRO;2;6;985533;CEL JTO A EE FABIO BARRETO DOUTOR;0;203;0;127;0;54;0;341;0;0;0;0;0;0;0;0;0;0;0;0;0;0;0;0;17;0;8;0;4;0;29;0;0;0;0;0;0;0;0;0;0;0;0;0;0;0;341;29
